{
  "$schema": "https://json-schema.org/draft/2020-12/schema",
  "$id": "https://nauticana.github.io/charter/schema/agent/agent_identity.schema.json",
  "title": "AgentIdentity",
  "description": "A stable agent identity, distinct from its definition, credentials, and runtime instances.",
  "x-charter-spec-version": "1.3.0",
  "x-charter-schema-version": "2.0.0",
  "x-charter-requirements": [
    "CHR-ID-001",
    "CHR-ID-002",
    "CHR-ID-003",
    "CHR-ID-004",
    "CHR-ID-007",
    "CHR-ID-009"
  ],
  "type": "object",
  "allOf": [
    {
      "$ref": "../common.schema.json#/$defs/documentBase"
    }
  ],
  "properties": {
    "charterSpecVersion": true,
    "namespace": true,
    "id": true,
    "name": true,
    "description": true,
    "lifecycleState": {
      "$ref": "../common.schema.json#/$defs/identityLifecycleState"
    },
    "validity": true,
    "extensions": true,
    "kind": {
      "const": "AgentIdentity"
    },
    "enterpriseId": {
      "$ref": "../common.schema.json#/$defs/idRef",
      "x-charter-ref-kinds": [
        "Enterprise"
      ]
    },
    "lifecycleAuthority": {
      "allOf": [
        {
          "$ref": "../common.schema.json#/$defs/objectRef"
        }
      ]
    },
    "lifecycleHistory": {
      "$ref": "../common.schema.json#/$defs/lifecycleHistory",
      "description": "Required semantically when this identity acts in a governed ActionRecord; optional for identities with no governed action evidence in the corpus."
    }
  },
  "required": [
    "kind",
    "name",
    "enterpriseId",
    "lifecycleState"
  ],
  "unevaluatedProperties": false
}
