{
  "charterSpecVersion": "1.3.0",
  "namespace": "harbor.example",
  "kind": "AgentIdentity",
  "id": "AGENT-ORDER-EXCEPTION-COORDINATOR",
  "enterpriseId": "ENT-HARBOR",
  "name": "Order Exception Coordinator",
  "lifecycleState": "active",
  "lifecycleHistory": [
    {
      "state": "active",
      "effectiveAt": "2026-01-01T00:00:00Z"
    }
  ],
  "lifecycleAuthority": {
    "kind": "Position",
    "id": "POS-SALES-OPERATIONS-MANAGER"
  }
}
