{
  "charterSpecVersion": "1.3.0",
  "namespace": "harbor.example",
  "kind": "AgentIdentity",
  "id": "AGENT-PLANNING-DATA-QUALITY",
  "enterpriseId": "ENT-HARBOR",
  "name": "Planning Data Quality Assistant",
  "lifecycleState": "active",
  "lifecycleAuthority": {
    "kind": "Position",
    "id": "PP-MGR-01"
  }
}
